{
  "active_artifact_receipts": [
    {
      "bytes": 4328,
      "path": ".agents/task_records/20260811_conv_native_four_lane_p38_return_analysis_only.md",
      "sha256": "7d9c6d7c90dc048a27591f0b947c4f02b1f72f3ad07d8f604ca2bceceff837f4"
    },
    {
      "bytes": 3756,
      "path": ".agents/task_records/20260811_rule_orthogonalization_session_refresh_and_next_fresh_dispatch.md",
      "sha256": "ef2f3c738af91c8ff00749720f00fc28acb2f95296bc2a76bf1e75732fc75a90"
    }
  ],
  "authority": {
    "new_owner_before_activation": "READ_ONLY_ACCEPTANCE",
    "old_owner_after_activation": "RETIRED_READ_ONLY",
    "overlap_writers_allowed": false
  },
  "claim_boundary": "Ownership continuity only; no package, server, RTL, config or result claim.",
  "current_mainline_thread_id": "019ff027-e7db-72a3-b282-cfad8708da05",
  "current_task_snapshot": {
    "next_action": "add bootstrap-safe compile root-cause evidence and pass new first-fresh exact-ZIP gates",
    "objective": "build the fresh native Conv successor after p38 compile-exit-2 return",
    "pointer": {
      "bytes": 4328,
      "path": ".agents/task_records/20260811_conv_native_four_lane_p38_return_analysis_only.md",
      "sha256": "7d9c6d7c90dc048a27591f0b947c4f02b1f72f3ad07d8f604ca2bceceff837f4"
    },
    "status": "ACTIVE"
  },
  "first_action": "acknowledge activation, re-read current gate identities, then build the fresh native Conv successor locally",
  "handoff_id": "handoff-0c0c6ba58da901a9b1e855e159b84187",
  "in_flight_snapshot": {
    "lease_id": null,
    "package": null,
    "return_zip": null,
    "server_root": null,
    "state": "NONE"
  },
  "new_thread_id": "019ff02d-974d-7c72-a4d5-de8dbf4ae60c",
  "old_thread_id": "019fc783-1146-7901-9e40-64d0ed8e052d",
  "owner_epoch_after": 2,
  "owner_epoch_before": 1,
  "pending_messages": [
    "current mainline is 019ff027-e7db-72a3-b282-cfad8708da05",
    "no server/RTL/config/numeric action during ownership activation"
  ],
  "reason": "planned full-project session refresh after active-rule orthogonalization",
  "registry_before": {
    "bytes": 11867,
    "path": "contracts/current_session_owner_registry_v1.json",
    "sha256": "3d943ed00d67e4e913ca97bd591f75c75b7d2914ed7c4b60f5f80a58d45a5fa1"
  },
  "registry_epoch_before": 4,
  "required_read_receipts": [
    {
      "bytes": 18926,
      "path": ".agents/agent.md",
      "sha256": "7a6fe116109b2c7953f3e1ff223160801e1d4df4ac6bfffc394c5ce4598294e4"
    },
    {
      "bytes": 44636,
      "path": ".agents/plan.md",
      "sha256": "4f04b3e207a5fd200b6bbc6e66b6c0a312d1e4f24317cd9266d31d2018aecc13"
    },
    {
      "bytes": 7874,
      "path": ".agents/rules/生成前必读索引.md",
      "sha256": "a69fc20ca32891912fb85b6060c743b7e25dbfc1ff690591432ccf1c4516bc86"
    },
    {
      "bytes": 8677,
      "path": ".agents/rules/会话转接与所有权规则.md",
      "sha256": "9e3859dff32de42f0964ff3038ab7b78c84d142a24016ee552c706ef01e529b9"
    },
    {
      "bytes": 11867,
      "path": "contracts/current_session_owner_registry_v1.json",
      "sha256": "3d943ed00d67e4e913ca97bd591f75c75b7d2914ed7c4b60f5f80a58d45a5fa1"
    },
    {
      "bytes": 9894,
      "path": "contracts/active_rule_registry_v1.json",
      "sha256": "bf014463ea4532cb7ce4b95267ee35f8b47931a76df8eee92497aed31456de92"
    },
    {
      "bytes": 37680,
      "path": ".agents/rules/算子配置规则.md",
      "sha256": "dc5243226bacde799b368d37fb9eb656e6b7e3d33a0a2932ae72ab35415ae3e1"
    },
    {
      "bytes": 14974,
      "path": ".agents/rules/NDP硬件字段语义.md",
      "sha256": "603d57805bc5a5bdfca7406c402bc94db60c06ea6682493d672abb91671b1055"
    },
    {
      "bytes": 144937,
      "path": ".agents/rules/服务器测试包生成规则.md",
      "sha256": "727f5dcb4a47fe054a13ed09b5a150f05de71148f820602a34b3ea38a4bbfe6a"
    },
    {
      "bytes": 10387,
      "path": ".agents/rules/INT8_SA点积专项规则.md",
      "sha256": "41c284d27a6f2176567e1d6495147ca625ea9023a93a7a8832c37999c78df927"
    },
    {
      "bytes": 7879,
      "path": ".agents/rules/RequantizeUint8算子配置规则.md",
      "sha256": "0275425ecee387361ebb3358bb6283e3c28ad8311171ce302f7551738d37f88a"
    },
    {
      "bytes": 6934,
      "path": ".agents/rules/精确UINT8量化尾专项规则.md",
      "sha256": "fef9ebcb1621e74ddd9aef0f936c5c8ce1fcf34c2be9000b1deeb4b11045ea4f"
    },
    {
      "bytes": 3298,
      "path": ".agents/rules/最小双Stage生命周期规则.md",
      "sha256": "821b8b04b0e33d0a93e06a3a1bca8307b417bcb63f109cf12414891e9a0bc171"
    }
  ],
  "role_id": "family.conv.native",
  "role_kind": "FAMILY_OWNER",
  "schema": "session-handoff-capsule-v1"
}
