{
  "active_artifact_receipts": [
    {
      "bytes": 1720,
      "path": ".agents/task_records/20260811_qlinearadd_node0007_v57d_runtime_failure_v57f_runnerfix.md",
      "sha256": "6cebd7fe58667209c138dfd7e6ca17a271e5e823a88227e88702d2ae774a43a5"
    },
    {
      "bytes": 3756,
      "path": ".agents/task_records/20260811_rule_orthogonalization_session_refresh_and_next_fresh_dispatch.md",
      "sha256": "ef2f3c738af91c8ff00749720f00fc28acb2f95296bc2a76bf1e75732fc75a90"
    },
    {
      "bytes": 70704126,
      "path": "artifacts/operator_config_validation/r5-server-test-packages/pending/r5_qadd_n7_tailround_lanephase_qual_v57f.zip",
      "sha256": "eeb922f3828b0e1dd6532bf0903e516351f0a4a0a9a0439b917e8e1b2532415e"
    }
  ],
  "authority": {
    "new_owner_before_activation": "READ_ONLY_ACCEPTANCE",
    "old_owner_after_activation": "RETIRED_READ_ONLY",
    "overlap_writers_allowed": false
  },
  "claim_boundary": "Ownership continuity only; no package, server, RTL, config or result claim.",
  "current_mainline_thread_id": "019ff027-e7db-72a3-b282-cfad8708da05",
  "current_task_snapshot": {
    "next_action": "run first-fresh exact-ZIP audit; build a fresh runner-only successor only if exact bytes fail",
    "objective": "re-audit v57f under the new runner definition-before-use and compilefail-return epoch",
    "pointer": {
      "bytes": 1720,
      "path": ".agents/task_records/20260811_qlinearadd_node0007_v57d_runtime_failure_v57f_runnerfix.md",
      "sha256": "6cebd7fe58667209c138dfd7e6ca17a271e5e823a88227e88702d2ae774a43a5"
    },
    "status": "PACKAGE_READY_NOT_RUN"
  },
  "first_action": "acknowledge activation, audit exact v57f under the new gate, and build a fresh runner-only successor only if required",
  "handoff_id": "handoff-b4d177c6b3011e73eb794ca69b5bece1",
  "in_flight_snapshot": {
    "lease_id": null,
    "package": {
      "bytes": 70704126,
      "path": "artifacts/operator_config_validation/r5-server-test-packages/pending/r5_qadd_n7_tailround_lanephase_qual_v57f.zip",
      "sha256": "eeb922f3828b0e1dd6532bf0903e516351f0a4a0a9a0439b917e8e1b2532415e"
    },
    "return_zip": null,
    "server_root": null,
    "state": "PACKAGE_READY_NOT_RUN"
  },
  "new_thread_id": "019ff02d-9e93-7d61-8c98-c928fdea157c",
  "old_thread_id": "019fa2c0-b647-7a91-93bf-d21a173487e3",
  "owner_epoch_after": 2,
  "owner_epoch_before": 1,
  "pending_messages": [
    "current mainline is 019ff027-e7db-72a3-b282-cfad8708da05",
    "no server/RTL/config/numeric action during ownership activation"
  ],
  "reason": "planned full-project session refresh after active-rule orthogonalization",
  "registry_before": {
    "bytes": 11867,
    "path": "contracts/current_session_owner_registry_v1.json",
    "sha256": "12654fc38ae398c533c3f2fd202e4bebef6f67e9e84b7731ee9b3d08d9d1fdda"
  },
  "registry_epoch_before": 5,
  "required_read_receipts": [
    {
      "bytes": 18926,
      "path": ".agents/agent.md",
      "sha256": "7a6fe116109b2c7953f3e1ff223160801e1d4df4ac6bfffc394c5ce4598294e4"
    },
    {
      "bytes": 44636,
      "path": ".agents/plan.md",
      "sha256": "4f04b3e207a5fd200b6bbc6e66b6c0a312d1e4f24317cd9266d31d2018aecc13"
    },
    {
      "bytes": 7874,
      "path": ".agents/rules/生成前必读索引.md",
      "sha256": "a69fc20ca32891912fb85b6060c743b7e25dbfc1ff690591432ccf1c4516bc86"
    },
    {
      "bytes": 8677,
      "path": ".agents/rules/会话转接与所有权规则.md",
      "sha256": "9e3859dff32de42f0964ff3038ab7b78c84d142a24016ee552c706ef01e529b9"
    },
    {
      "bytes": 11867,
      "path": "contracts/current_session_owner_registry_v1.json",
      "sha256": "12654fc38ae398c533c3f2fd202e4bebef6f67e9e84b7731ee9b3d08d9d1fdda"
    },
    {
      "bytes": 9894,
      "path": "contracts/active_rule_registry_v1.json",
      "sha256": "bf014463ea4532cb7ce4b95267ee35f8b47931a76df8eee92497aed31456de92"
    },
    {
      "bytes": 37680,
      "path": ".agents/rules/算子配置规则.md",
      "sha256": "dc5243226bacde799b368d37fb9eb656e6b7e3d33a0a2932ae72ab35415ae3e1"
    },
    {
      "bytes": 14974,
      "path": ".agents/rules/NDP硬件字段语义.md",
      "sha256": "603d57805bc5a5bdfca7406c402bc94db60c06ea6682493d672abb91671b1055"
    },
    {
      "bytes": 144937,
      "path": ".agents/rules/服务器测试包生成规则.md",
      "sha256": "727f5dcb4a47fe054a13ed09b5a150f05de71148f820602a34b3ea38a4bbfe6a"
    },
    {
      "bytes": 16337,
      "path": ".agents/rules/QLinearAdd算子配置规则.md",
      "sha256": "54de9e9c7354bc461a8c3411481687f56f11f7be8d81a6e712dd6cdc63352f2b"
    },
    {
      "bytes": 6934,
      "path": ".agents/rules/精确UINT8量化尾专项规则.md",
      "sha256": "fef9ebcb1621e74ddd9aef0f936c5c8ce1fcf34c2be9000b1deeb4b11045ea4f"
    },
    {
      "bytes": 3298,
      "path": ".agents/rules/最小双Stage生命周期规则.md",
      "sha256": "821b8b04b0e33d0a93e06a3a1bca8307b417bcb63f109cf12414891e9a0bc171"
    }
  ],
  "role_id": "family.qlinearadd",
  "role_kind": "FAMILY_OWNER",
  "schema": "session-handoff-capsule-v1"
}
